url,title,requirements,duration_months,scraped_at,success_indicators
https://github.com/microsoft/BotBuilder-Samples/tree/main/samples/python/02.echo-bot,BotBuilder-Samples/samples/python/02.echo-bot at main · microsoft/BotBuilder-Samples · GitHub,"['echo-bot folder\nActivate your desired virtual environment\nIn the terminal, type pip install -r requirements']",,2025-02-20T22:33:41.475000,"['Deploy the bot to Azure\nTo learn more about deploying a bot to Azure, see Deploy your bot to Azure for a complete list of deployment instructions']"
https://github.com/microsoft/BotBuilder-Samples/tree/main/samples/python/13.core-bot,BotBuilder-Samples/samples/python/13.core-bot at main · microsoft/BotBuilder-Samples · GitHub,"['Implement a multi-turn conversation using Dialogs', 'prerequisites in order to run.', 'This sample requires prerequisites in order to run.', 'This bot has been created using Bot Framework, it shows how to:\n\nUse LUIS to implement core AI capabilities\nImplement a multi-turn conversation using Dialogs\nHandle user interruptions for such things as Help or Cancel\nPrompt for and validate requests for information from the user\n\nPrerequisites\nThis sample requires prerequisites in order to run', 'core-bot folder\nActivate your desired virtual environment\nIn the terminal, type pip install -r requirements']",,2025-02-20T22:33:41.580700,"['Implement a multi-turn conversation using Dialogs', 'Install the latest Bot Framework Emulator from here\n\nConnect to the bot using Bot Framework Emulator\n\nLaunch Bot Framework Emulator\nFile -> Open Bot\nEnter a Bot URL of http://localhost:3978/api/messages\n\nDeploy the bot to Azure\nTo learn more about deploying a bot to Azure, see Deploy your bot to Azure for a complete list of deployment instructions']"
https://github.com/microsoft/BotBuilder-Samples/tree/main/samples/python/45.state-management,BotBuilder-Samples/samples/python/45.state-management at main · microsoft/BotBuilder-Samples · GitHub,"['Depending on what your bot is used for, you may even need to keep track of state or store information for longer than the lifetime of the conversation', 'state-management folder\nActivate your desired virtual environment\nIn the terminal, type pip install -r requirements']",,2025-02-20T22:33:41.297701,"['Deploy the bot to Azure\nTo learn more about deploying a bot to Azure, see Deploy your bot to Azure for a complete list of deployment instructions']"
https://github.com/microsoft/BotBuilder-Samples/tree/main/samples/python/16.proactive-messages,BotBuilder-Samples/samples/python/16.proactive-messages at main · microsoft/BotBuilder-Samples · GitHub,"['In some cases, a bot may need to send the user a message that is not directly related to the current topic of conversation', ""Or, if a bot requires some time to compile a response to the user's question, it may inform the user of the delay and allow the conversation to continue in the meantime"", 'proactive-messages folder\nActivate your desired virtual environment\nIn the terminal, type pip install -r requirements', 'first capture a conversation reference from an incoming message using TurnContext.getConversationReference(). This reference can be stored for later use.', 'If a bot sets a timer or reminder, it will need to notify the user when the time arrives', 'In order to send a proactive message using Bot Framework, the bot must first capture a conversation reference from an incoming message using TurnContext', 'Or, if a bot receives a notification from an external system, it may need to communicate that information to the user immediately']",,2025-02-20T22:33:41.508531,"['Deploy this bot to Azure\nTo learn more about deploying a bot to Azure, see Deploy your bot to Azure for a complete list of deployment instructions']"
https://github.com/microsoft/BotBuilder-Samples/tree/main/samples/python/44.prompt-for-user-input,BotBuilder-Samples/samples/python/44.prompt-for-user-input at main · microsoft/BotBuilder-Samples · GitHub,"['prompt-for-user-input folder\nActivate your desired virtual environment\nIn the terminal, type pip install -r requirements']",,2025-02-20T22:33:41.210168,"['Install the latest Bot Framework Emulator from here\n\nConnect to the bot using Bot Framework Emulator\n\nLaunch Bot Framework Emulator\nFile -> Open Bot\nEnter a Bot URL of http://localhost:3978/api/messages\n\nDeploy the bot to Azure\nTo learn more about deploying a bot to Azure, see Deploy your bot to Azure for a complete list of deployment instructions']"
https://github.com/microsoft/BotBuilder-Samples/tree/main/samples/python/24.bot-authentication-msgraph,BotBuilder-Samples/samples/python/24.bot-authentication-msgraph at main · microsoft/BotBuilder-Samples · GitHub,"['to make it easier to develop a bot that', 'use or verify the user has a valid token at any point the OAuth prompt may be sent. If the token is not valid they will be prompted to login.', ""It is important to note that the user's token does not need to be stored in the bot"", 'When the bot needs to use or verify the user has a valid token at any point the OAuth prompt may be sent', 'of Azure Bot Service, providing features to make it easier to develop a bot that', 'py with required configuration settings\n\nMicrosoftAppId\nMicrosoftAppPassword\nConnectionName\n\n\nActivate your desired virtual environment\nIn the terminal, type pip install -r requirements', 'of Azure Bot Service. In this sample we are assuming the OAuth 2 provider is Azure Active Directory v2 (AADv2) and are utilizing the Microsoft Graph API to retrieve data about the user. Check here for information about getting an AADv2', 'to use or verify the user has a valid token at any point the OAuth prompt may be sent. If the token is not valid they will be prompted to login.']",,2025-02-20T22:33:41.821566,"['These updates also\ntake steps towards an improved user experience by eliminating the magic code verification for some clients and channels', 'of Azure Bot Service, providing features to make it easier to develop a bot that', 'user experience by eliminating the magic code verification for some clients and channels.', 'Deploy the bot to Azure\nTo learn more about deploying a bot to Azure, see Deploy your bot to Azure for a complete list of deployment instructions', 'of Azure Bot Service. In this sample we are assuming the OAuth 2 provider is Azure Active Directory v2 (AADv2) and are utilizing the Microsoft Graph API to retrieve data about the user. Check here for information about getting an AADv2']"
